{
  "$schema": "http://json-schema.org/draft-07/schema#",
  "$id": "https://github.com/rmems/operation-prometheus/schemas/local_model_admission.schema.json",
  "title": "local_model_admission_v1",
  "description": "Singular fail-closed admission report for one local model provider candidate (e.g. a loopback Ollama-served Hermes weight). This is the canonical object emitted by verify_local_model_admission.py and consumed/hashed downstream. `decision` is `accepted` only when every binding holds; missing or conflicting identity/rights/endpoint/fallback evidence always yields `quarantined` or `rejected` with machine-readable `reasons`.",
  "type": "object",
  "required": [
    "schema_version",
    "decision",
    "reasons",
    "model",
    "runtime",
    "rights",
    "provider",
    "cloud_fallback_allowed",
    "fallback_evidence",
    "probe",
    "input_digests",
    "evidence_digest"
  ],
  "additionalProperties": false,
  "allOf": [
    {"$ref": "#/definitions/accepted_constraints"},
    {"$ref": "#/definitions/non_accepted_constraints"}
  ],
  "properties": {
    "schema_version": {"const": "local_model_admission_v1"},
    "decision": {"enum": ["accepted", "quarantined", "rejected"]},
    "reasons": {
      "type": "array",
      "items": {"type": "string", "minLength": 1}
    },
    "model": {
      "type": "object",
      "required": [
        "name",
        "tag",
        "ollama_digest",
        "quantization",
        "upstream_revision"
      ],
      "additionalProperties": false,
      "properties": {
        "name": {"type": ["string", "null"]},
        "tag": {"type": ["string", "null"]},
        "ollama_digest": {
          "type": ["string", "null"],
          "pattern": "^sha256:[a-f0-9]{64}$"
        },
        "quantization": {"type": ["string", "null"]},
        "upstream_revision": {"type": ["string", "null"]}
      }
    },
    "runtime": {
      "type": "object",
      "required": ["name", "version", "endpoint"],
      "additionalProperties": false,
      "properties": {
        "name": {"type": ["string", "null"]},
        "version": {"type": ["string", "null"]},
        "endpoint": {"type": ["string", "null"]}
      }
    },
    "rights": {
      "type": "object",
      "required": ["identifier", "terms_source", "terms_sha256"],
      "additionalProperties": false,
      "properties": {
        "identifier": {"type": ["string", "null"]},
        "terms_source": {"type": ["string", "null"]},
        "terms_sha256": {
          "type": ["string", "null"],
          "pattern": "^[a-f0-9]{64}$"
        }
      }
    },
    "provider": {
      "type": "object",
      "required": ["name", "config"],
      "additionalProperties": false,
      "properties": {
        "name": {"const": "hermes-agent"},
        "config": {"type": ["object", "null"]}
      }
    },
    "cloud_fallback_allowed": {"type": ["boolean", "null"]},
    "fallback_evidence": {
      "type": "object",
      "required": [
        "no_cloud",
        "cloud_fallback_allowed",
        "unsanitized_keys",
        "remote_endpoints"
      ],
      "additionalProperties": false,
      "properties": {
        "no_cloud": {"type": ["boolean", "null"]},
        "cloud_fallback_allowed": {"type": ["boolean", "null"]},
        "unsanitized_keys": {
          "type": "array",
          "items": {"type": "string"}
        },
        "remote_endpoints": {
          "type": "array",
          "items": {"type": "string"}
        }
      }
    },
    "probe": {
      "type": "object",
      "required": ["timestamp", "endpoint"],
      "additionalProperties": false,
      "properties": {
        "timestamp": {"type": ["string", "null"]},
        "endpoint": {"type": ["string", "null"]}
      }
    },
    "input_digests": {
      "type": "object",
      "additionalProperties": {"$ref": "#/definitions/sha256"}
    },
    "evidence_digest": {"$ref": "#/definitions/sha256"}
  },
  "definitions": {
    "sha256": {
      "type": "string",
      "pattern": "^[a-f0-9]{64}$"
    },
    "loopback_endpoint": {
      "type": "string",
      "pattern": "^http://(127\\.0\\.0\\.1|localhost|\\[::1\\]):[0-9]+/?$"
    },
    "model_name_part": {
      "type": "string",
      "pattern": "^[A-Za-z0-9][A-Za-z0-9._-]*$"
    },
    "accepted_constraints": {
      "if": {
        "properties": {"decision": {"const": "accepted"}},
        "required": ["decision"]
      },
      "then": {
        "properties": {
          "reasons": {"maxItems": 0},
          "model": {
            "type": "object",
            "properties": {
              "name": {"$ref": "#/definitions/model_name_part"},
              "tag": {"$ref": "#/definitions/model_name_part"},
              "ollama_digest": {
                "type": "string",
                "pattern": "^sha256:[a-f0-9]{64}$"
              },
              "quantization": {"type": "string", "minLength": 1}
            }
          },
          "runtime": {
            "type": "object",
            "properties": {
              "name": {"const": "ollama"},
              "version": {"type": "string", "minLength": 1},
              "endpoint": {"$ref": "#/definitions/loopback_endpoint"}
            }
          },
          "rights": {
            "type": "object",
            "properties": {
              "identifier": {"type": "string", "minLength": 1},
              "terms_source": {"type": "string", "minLength": 1},
              "terms_sha256": {
                "type": "string",
                "pattern": "^[a-f0-9]{64}$"
              }
            }
          },
          "provider": {
            "type": "object",
            "properties": {
              "name": {"const": "hermes-agent"},
              "config": {"$ref": "#/definitions/closed_config"}
            }
          },
          "cloud_fallback_allowed": {"const": false},
          "fallback_evidence": {
            "type": "object",
            "properties": {
              "no_cloud": {"const": true},
              "cloud_fallback_allowed": {"const": false},
              "unsanitized_keys": {"type": "array", "maxItems": 0},
              "remote_endpoints": {"type": "array", "maxItems": 0}
            }
          },
          "probe": {
            "type": "object",
            "properties": {
              "timestamp": {
                "type": "string",
                "pattern": "^\\d{4}-\\d{2}-\\d{2}T\\d{2}:\\d{2}:\\d{2}(\\.\\d+)?(Z|[+-]\\d{2}:\\d{2})$"
              },
              "endpoint": {"$ref": "#/definitions/loopback_endpoint"}
            }
          },
          "input_digests": {
            "type": "object",
            "required": ["admissions", "rights", "probe"],
            "properties": {
              "admissions": {"$ref": "#/definitions/sha256"},
              "rights": {"$ref": "#/definitions/sha256"},
              "probe": {"$ref": "#/definitions/sha256"},
              "inputs_manifest": {"$ref": "#/definitions/sha256"}
            }
          }
        }
      }
    },
    "non_accepted_constraints": {
      "if": {
        "properties": {"decision": {"enum": ["quarantined", "rejected"]}},
        "required": ["decision"]
      },
      "then": {
        "properties": {
          "reasons": {"type": "array", "minItems": 1}
        }
      }
    },
    "closed_config": {
      "type": "object",
      "required": ["no_cloud", "cloud_fallback_allowed"],
      "additionalProperties": false,
      "properties": {
        "no_cloud": {"const": true},
        "cloud_fallback_allowed": {"const": false},
        "num_ctx": {"type": "integer", "minimum": 0},
        "num_predict": {"type": "integer", "minimum": 0},
        "num_gpu": {"type": "integer", "minimum": 0},
        "num_thread": {"type": "integer", "minimum": 0},
        "num_batch": {"type": "integer", "minimum": 0},
        "temperature": {"type": "number", "minimum": 0},
        "top_k": {"type": "integer", "minimum": 0},
        "top_p": {"type": "number", "minimum": 0},
        "min_p": {"type": "number", "minimum": 0},
        "tfs_z": {"type": "number", "minimum": 0},
        "typical_p": {"type": "number", "minimum": 0},
        "seed": {"type": "integer"},
        "keep_alive": {"type": "string"},
        "repeat_penalty": {"type": "number", "minimum": 0},
        "presence_penalty": {"type": "number"},
        "frequency_penalty": {"type": "number"},
        "mirostat": {"type": "integer"},
        "mirostat_eta": {"type": "number", "minimum": 0},
        "mirostat_tau": {"type": "number", "minimum": 0},
        "stop": {
          "type": "array",
          "items": {"type": "string"}
        }
      }
    }
  }
}
