{"cloud_fallback_allowed":false,"decision":"accepted","evidence_digest":"bccb5d7df3ecb8bdc107f4832509f4a1b9a84195c9ebe94cd30ddd417d2abc6d","fallback_evidence":{"cloud_fallback_allowed":false,"no_cloud":true,"remote_endpoints":[],"unsanitized_keys":[]},"input_digests":{"admissions":"dddddddddddddddddddddddddddddddddddddddddddddddddddddddddddddddd","probe":"cccccccccccccccccccccccccccccccccccccccccccccccccccccccccccccccc","rights":"aaaaaaaaaaaaaaaaaaaaaaaaaaaaaaaaaaaaaaaaaaaaaaaaaaaaaaaaaaaaaaaa"},"model":{"name":"qwen2.5-coder","ollama_digest":"sha256:0123456789abcdef0123456789abcdef0123456789abcdef0123456789abcdef","quantization":"q4_K_M","tag":"7b-instruct","upstream_revision":"synthetic-upstream-1"},"probe":{"endpoint":"http://127.0.0.1:11434","timestamp":"2026-09-21T11:00:00Z"},"provider":{"config":{"cloud_fallback_allowed":false,"no_cloud":true},"name":"hermes-agent"},"reasons":[],"rights":{"identifier":"Apache-2.0","terms_sha256":"aaaaaaaaaaaaaaaaaaaaaaaaaaaaaaaaaaaaaaaaaaaaaaaaaaaaaaaaaaaaaaaa","terms_source":"synthetic-fixture"},"runtime":{"endpoint":"http://127.0.0.1:11434","name":"ollama","version":"0.11.4"},"schema_version":"local_model_admission_v1"}
